Movie,Year,Keywords,Synopsis,Love · Romance · Family · Community · Belonging · Home,Happy · Playful · Bright · Feel-good · Carefree,Hopeful · Healing · Optimistic · Reassuring,Excited · Adventurous · Fun · Escapist,Reflective · Introspective · Contemplative About Life,Calm · Peaceful · Relaxed · Soft · Gentle,Curious · Engaged · Intrigued · Mentally Active,Intense · Emotional · Cathartic · Bittersweet,Lonely · Isolated · Unseen · Longing,Angry · Frustrated · Irritated · Stressed,Hopeless · Sad · Heartbroken · Melancholy,Scared · Anxious · Uneasy · Tense · Nervous
Trolls World Tour,2020,"diversity, collaboration, music, understanding, harmony","Poppy and friends travel to unite different musical tribes, promoting unity, joy, and celebrating differences.",0.7,0.9,0.8,0.8,0.6,0.5,0.8,0.6,0.4,0.3,0.3,0.3
Parasite,2019,"social inequality, greed, deception, survival, morality","A poor family infiltrates a wealthy household, exposing class tension, greed, and societal inequalities, culminating in dramatic consequences.",0.4,0.3,0.5,0.5,0.7,0.4,0.6,0.8,0.6,0.6,0.8,0.6
Doctor Strange: The Sorcerer Supreme,2007,"magic, responsibility, transformation, courage, destiny","Doctor Strange learns the mystic arts after a career-ending accident, confronting magical threats while discovering humility, knowledge, and heroism.",0.5,0.5,0.7,0.9,0.6,0.5,0.8,0.7,0.5,0.4,0.5,0.5
The Pursuit of Happyness,2006,"perseverance, hope, fatherhood, ambition, resilience","Chris Gardner struggles with homelessness while raising his son, persevering to achieve financial stability and fulfill his dreams.",0.8,0.5,0.9,0.6,0.7,0.5,0.7,0.8,0.6,0.5,0.6,0.5
Miracle in Cell No. 7,2013,"love, innocence, justice, family, sacrifice","A mentally challenged man is wrongfully imprisoned; his daughter and fellow inmates show love, compassion, and hope in the face of injustice.",0.9,0.6,0.9,0.5,0.7,0.5,0.7,0.9,0.6,0.5,0.7,0.4
13 Going on 30,2004,"self-discovery, friendship, love, growth, transformation","A teenager magically wakes up as her 30-year-old self and learns what truly matters in love, friendship, and life.",0.8,0.8,0.7,0.6,0.6,0.6,0.7,0.6,0.4,0.3,0.4,0.2
A Walk to Remember,2002,"love, faith, sacrifice, growth, loss","A rebellious teen falls in love with a quiet girl who teaches him faith, love, and loss.",0.9,0.4,0.6,0.3,0.8,0.5,0.6,0.9,0.7,0.4,0.9,0.4
Me Before You,2016,"love, sacrifice, life choices, empathy, personal growth","A cheerful woman forms a deep bond with a paralyzed man, challenging ideas of love, autonomy, and happiness.",0.9,0.5,0.5,0.4,0.8,0.5,0.7,0.9,0.7,0.5,0.9,0.4
The Gorge,2025,"survival, adventure, discovery, resilience, self-realization",Two elite operatives guard opposite sides of a mysterious gorge and form a forbidden bond as hidden horrors emerge.,0.6,0.3,0.4,0.8,0.7,0.3,0.7,0.8,0.6,0.6,0.5,0.8
Five Feet Apart,2019,"love, vulnerability, illness, connection, hope",Two teens with cystic fibrosis fall in love but must stay physically apart to survive.,0.9,0.4,0.6,0.3,0.8,0.5,0.6,0.9,0.7,0.4,0.9,0.5
The Fault in Our Stars,2014,"love, mortality, courage, connection, grief",Two teens with cancer fall in love while confronting mortality and meaning.,0.9,0.4,0.6,0.3,0.8,0.5,0.6,0.9,0.7,0.5,0.9,0.5
Paper Towns,2015,"mystery, self-discovery, friendship, adventure, growth","A teen searches for a mysterious girl who disappears, leading him to self-discovery and emotional growth.",0.6,0.5,0.6,0.6,0.7,0.4,0.7,0.7,0.6,0.4,0.6,0.3
Two Weeks Notice,2002,"love, compromise, independence, career, humor","A lawyer resigns from her billionaire boss, forcing both to realize their dependence and love.",0.8,0.7,0.7,0.4,0.5,0.5,0.6,0.6,0.4,0.3,0.4,0.2
While You Were Sleeping,1995,"love, family, kindness, serendipity, personal growth",A woman is mistaken as a man’s fiancée and finds unexpected love and family.,0.9,0.7,0.8,0.4,0.6,0.6,0.6,0.7,0.4,0.3,0.4,0.2
Miss Congeniality,2000,"identity, empowerment, humor, self-confidence, transformation","An FBI agent goes undercover in a beauty pageant and discovers friendship, confidence, and love.",0.7,0.8,0.7,0.7,0.5,0.5,0.7,0.6,0.4,0.4,0.4,0.3
Jumanji: Welcome to the Jungle,2017,"teamwork, adventure, courage, self-discovery, friendship",Teens trapped in a video game must work together to survive and escape.,0.6,0.8,0.7,0.9,0.5,0.4,0.8,0.6,0.3,0.4,0.3,0.5